{
  "id": "charneca_das_lanternas",
  "nome_id": "D1.CHARNECA.NOME",
  "sem_spawn_antes_do_marco_s": 30,
  "a_fome_em_s": 1380,
  "inicio_jogador": {
    "x": 585,
    "y": 1266
  },
  "obstaculos": [
    { "x": 331, "y": 105, "forma": "circulo", "tamanho_px": 96 },
    { "x": 225, "y": 245, "forma": "circulo", "tamanho_px": 96 },
    { "x": 163, "y": 514, "forma": "circulo", "tamanho_px": 64 },
    { "x": 307, "y": 636, "forma": "circulo", "tamanho_px": 64 },
    { "x": 384, "y": 791, "forma": "circulo", "tamanho_px": 80 },
    { "x": 215, "y": 802, "forma": "circulo", "tamanho_px": 96 },
    { "x": 704, "y": 82, "forma": "circulo", "tamanho_px": 64 },
    { "x": 497, "y": 406, "forma": "circulo", "tamanho_px": 80 },
    { "x": 607, "y": 518, "forma": "circulo", "tamanho_px": 64 },
    { "x": 771, "y": 525, "forma": "circulo", "tamanho_px": 80 },
    { "x": 435, "y": 570, "forma": "circulo", "tamanho_px": 80 },
    { "x": 641, "y": 695, "forma": "circulo", "tamanho_px": 96 },
    { "x": 537, "y": 836, "forma": "circulo", "tamanho_px": 64 },
    { "x": 1026, "y": 234, "forma": "circulo", "tamanho_px": 64 },
    { "x": 1031, "y": 407, "forma": "circulo", "tamanho_px": 96 },
    { "x": 913, "y": 709, "forma": "circulo", "tamanho_px": 64 },
    { "x": 1100, "y": 717, "forma": "circulo", "tamanho_px": 64 },
    { "x": 846, "y": 837, "forma": "circulo", "tamanho_px": 64 },
    { "x": 49, "y": 1043, "forma": "circulo", "tamanho_px": 80 },
    { "x": 263, "y": 1109, "forma": "circulo", "tamanho_px": 96 },
    { "x": 230, "y": 1278, "forma": "circulo", "tamanho_px": 80 },
    { "x": 62, "y": 1353, "forma": "circulo", "tamanho_px": 80 },
    { "x": 231, "y": 1438, "forma": "circulo", "tamanho_px": 64 },
    { "x": 119, "y": 1538, "forma": "circulo", "tamanho_px": 96 },
    { "x": 353, "y": 1581, "forma": "circulo", "tamanho_px": 80 },
    { "x": 234, "y": 1675, "forma": "circulo", "tamanho_px": 80 },
    { "x": 407, "y": 1044, "forma": "circulo", "tamanho_px": 80 },
    { "x": 776, "y": 1500, "forma": "circulo", "tamanho_px": 80 },
    { "x": 637, "y": 1572, "forma": "circulo", "tamanho_px": 64 },
    { "x": 530, "y": 1679, "forma": "circulo", "tamanho_px": 96 },
    { "x": 992, "y": 859, "forma": "circulo", "tamanho_px": 80 },
    { "x": 1055, "y": 1065, "forma": "circulo", "tamanho_px": 96 },
    { "x": 889, "y": 1080, "forma": "circulo", "tamanho_px": 64 },
    { "x": 930, "y": 1420, "forma": "circulo", "tamanho_px": 96 },
    { "x": 1067, "y": 1547, "forma": "circulo", "tamanho_px": 80 },
    { "x": 831, "y": 1644, "forma": "circulo", "tamanho_px": 64 },
    { "x": 158, "y": 1813, "forma": "circulo", "tamanho_px": 64 },
    { "x": 49, "y": 1928, "forma": "circulo", "tamanho_px": 64 },
    { "x": 179, "y": 2010, "forma": "circulo", "tamanho_px": 96 },
    { "x": 351, "y": 2262, "forma": "circulo", "tamanho_px": 64 },
    { "x": 110, "y": 2296, "forma": "circulo", "tamanho_px": 96 },
    { "x": 677, "y": 1745, "forma": "circulo", "tamanho_px": 64 },
    { "x": 447, "y": 1854, "forma": "circulo", "tamanho_px": 96 },
    { "x": 741, "y": 2071, "forma": "circulo", "tamanho_px": 64 },
    { "x": 602, "y": 2081, "forma": "circulo", "tamanho_px": 80 },
    { "x": 608, "y": 2380, "forma": "circulo", "tamanho_px": 80 },
    { "x": 419, "y": 2441, "forma": "circulo", "tamanho_px": 80 },
    { "x": 762, "y": 2475, "forma": "circulo", "tamanho_px": 80 },
    { "x": 942, "y": 1745, "forma": "circulo", "tamanho_px": 96 },
    { "x": 825, "y": 1871, "forma": "circulo", "tamanho_px": 96 },
    { "x": 993, "y": 1958, "forma": "circulo", "tamanho_px": 80 },
    { "x": 1127, "y": 2208, "forma": "circulo", "tamanho_px": 64 },
    { "x": 873, "y": 2243, "forma": "circulo", "tamanho_px": 64 },
    { "x": 1118, "y": 2422, "forma": "circulo", "tamanho_px": 64 }
  ],
  "linhas": [
    {
      "minuto": 0,
      "roster": [
        {
          "inimigo": "oco_das_lanternas",
          "peso": 10
        }
      ],
      "min_na_tela": 15,
      "intervalo_s": 2.0
    },
    {
      "minuto": 1,
      "roster": [
        {
          "inimigo": "oco_das_lanternas",
          "peso": 10
        },
        {
          "inimigo": "oco_grande",
          "peso": 1
        }
      ],
      "min_na_tela": 25,
      "intervalo_s": 1.6,
      "garantidos": [
        {
          "inimigo": "oco_grande",
          "quantidade": 1,
          "tutorial": "esquiva"
        }
      ]
    },
    {
      "minuto": 2,
      "roster": [
        {
          "inimigo": "oco_das_lanternas",
          "peso": 10
        },
        {
          "inimigo": "oco_grande",
          "peso": 1
        }
      ],
      "min_na_tela": 35,
      "intervalo_s": 1.4
    },
    {
      "minuto": 3,
      "roster": [
        {
          "inimigo": "oco_das_lanternas",
          "peso": 10
        },
        {
          "inimigo": "oco_grande",
          "peso": 1
        },
        {
          "inimigo": "novica_de_sal",
          "peso": 2
        }
      ],
      "min_na_tela": 45,
      "intervalo_s": 1.2,
      "garantidos": [
        {
          "inimigo": "novica_de_sal",
          "quantidade": 1,
          "tutorial": "aparo"
        }
      ]
    },
    {
      "minuto": 4,
      "roster": [
        {
          "inimigo": "oco_das_lanternas",
          "peso": 10
        },
        {
          "inimigo": "oco_grande",
          "peso": 1
        },
        {
          "inimigo": "novica_de_sal",
          "peso": 2
        }
      ],
      "min_na_tela": 55,
      "intervalo_s": 1.0
    },
    {
      "minuto": 5,
      "roster": [],
      "min_na_tela": 40,
      "intervalo_s": null,
      "marco": {
        "tipo": "guardiao",
        "indice": 1,
        "inimigos": [
          {
            "inimigo": "oco_grande_coroado",
            "hp_base": 600,
            "quantidade": 1
          }
        ],
        "bau": "comum"
      }
    },
    {
      "minuto": 6,
      "roster": [
        {
          "inimigo": "oco_das_lanternas",
          "peso": 8
        },
        {
          "inimigo": "oco_grande",
          "peso": 3
        },
        {
          "inimigo": "novica_de_sal",
          "peso": 3
        }
      ],
      "min_na_tela": 70,
      "intervalo_s": 0.9
    },
    {
      "minuto": 7,
      "roster": [
        {
          "inimigo": "oco_das_lanternas",
          "peso": 8
        },
        {
          "inimigo": "oco_grande",
          "peso": 3
        },
        {
          "inimigo": "novica_de_sal",
          "peso": 3
        }
      ],
      "min_na_tela": 80,
      "intervalo_s": 0.8
    },
    {
      "minuto": 8,
      "roster": [
        {
          "inimigo": "oco_das_lanternas",
          "peso": 8
        },
        {
          "inimigo": "oco_grande",
          "peso": 3
        },
        {
          "inimigo": "novica_de_sal",
          "peso": 3
        }
      ],
      "min_na_tela": 90,
      "intervalo_s": 0.8
    },
    {
      "minuto": 9,
      "roster": [
        {
          "inimigo": "oco_das_lanternas",
          "peso": 8
        },
        {
          "inimigo": "oco_grande",
          "peso": 3
        },
        {
          "inimigo": "novica_de_sal",
          "peso": 3
        }
      ],
      "min_na_tela": 100,
      "intervalo_s": 0.7
    },
    {
      "minuto": 10,
      "roster": [],
      "min_na_tela": 60,
      "intervalo_s": null,
      "marco": {
        "tipo": "chefe_menor",
        "indice": 1,
        "inimigos": [
          {
            "inimigo": "oco_grande_coroado",
            "hp_base": 1000,
            "quantidade": 1
          }
        ],
        "bau": "dourado"
      }
    },
    {
      "minuto": 11,
      "roster": [
        {
          "inimigo": "oco_das_lanternas",
          "peso": 6
        },
        {
          "inimigo": "oco_grande",
          "peso": 4
        },
        {
          "inimigo": "novica_de_sal",
          "peso": 4
        }
      ],
      "min_na_tela": 120,
      "intervalo_s": 0.6
    },
    {
      "minuto": 12,
      "roster": [
        {
          "inimigo": "oco_das_lanternas",
          "peso": 6
        },
        {
          "inimigo": "oco_grande",
          "peso": 4
        },
        {
          "inimigo": "novica_de_sal",
          "peso": 4
        }
      ],
      "min_na_tela": 140,
      "intervalo_s": 0.6
    },
    {
      "minuto": 13,
      "roster": [
        {
          "inimigo": "oco_das_lanternas",
          "peso": 6
        },
        {
          "inimigo": "oco_grande",
          "peso": 4
        },
        {
          "inimigo": "novica_de_sal",
          "peso": 4
        }
      ],
      "min_na_tela": 160,
      "intervalo_s": 0.5
    },
    {
      "minuto": 14,
      "roster": [
        {
          "inimigo": "oco_das_lanternas",
          "peso": 6
        },
        {
          "inimigo": "oco_grande",
          "peso": 4
        },
        {
          "inimigo": "novica_de_sal",
          "peso": 4
        }
      ],
      "min_na_tela": 180,
      "intervalo_s": 0.5
    },
    {
      "minuto": 15,
      "roster": [],
      "min_na_tela": 80,
      "intervalo_s": null,
      "marco": {
        "tipo": "guardiao",
        "indice": 2,
        "inimigos": [
          {
            "inimigo": "oco_grande_coroado",
            "hp_base": 600,
            "quantidade": 2
          }
        ],
        "bau": "comum"
      }
    },
    {
      "minuto": 16,
      "roster": [
        {
          "inimigo": "oco_das_lanternas",
          "peso": 6
        },
        {
          "inimigo": "oco_grande",
          "peso": 5
        },
        {
          "inimigo": "novica_de_sal",
          "peso": 4
        }
      ],
      "min_na_tela": 200,
      "intervalo_s": 0.45,
      "escurecer_pct": 10
    },
    {
      "minuto": 17,
      "roster": [
        {
          "inimigo": "oco_das_lanternas",
          "peso": 6
        },
        {
          "inimigo": "oco_grande",
          "peso": 5
        },
        {